date;ticker;sector;title;content;sentiment
06/10/25 02:00;LVMH MOËT HENNESSY LOUIS VUITTON SE (MC);Textile Habillement Accessoires;LVMH has strong annual results and remarkable growth in luxury;"LVMH MOËT HENNESSY LOUIS VUITTON SE (MC) (+11.05% to 528.48 euros) is the leading player in the stock market after revealing robust annual results despite a disturbed environment. In the wake of this performance, luxury values are on the rise. All LVMH MOËT HENNESSY LOUIS VUITTON SE (MC)'s activities show sustained organic growth of their sales with the exception of wines and spirits. The group achieved two-digit organic growth in Europe, Japan and the rest of Asia. In 2024, its current operating result was at a level comparable to that of 2023, at 22.8 billion euros by adjusting the 2023 data for a better comparison. The current operating margin is stable compared to 2023. The group's net share is 12.5 billion euros. Its sales amount to €84.6 billion, an organic growth of 7% compared to €2023 (79.1 billion). LVMH MOËT HENNESSY LOUIS VUITTON SE (MC) signs a remarkable performance of fashion and leather goods activity with an organic growth of 8% of its sales (€42 billion). Perfume and cosmetics activity also shows a particularly strong dynamic: organic growth of 7% of sales. Watches and jewellery activity achieves an organic growth of 5% of its sales in 2024. However, its sales of wines and spirits decreased by 3% in organic because of a base of comparison and a high stock level. But LVMH MOËT HENNESSY LOUIS VUITTON SE (MC) points out that the year 2024 was marked by an increase in champagne. Stifel: ""good cost control"". Commenting on these annual results, Stifel remains at the Achat on the title LVMH MOËT HENNESSY LOUIS VUITTON SE (MC) now its price target at a comparable level. ""In terms of profitability, investors were afraid of a failure, but good cost control helped to beat the consensus. The group's operating margin has exceeded expectations. The Financial Director confirmed that the group wants to maintain the current level of profitability by 2025 thanks to new cost control measures. LVMH MOËT HENNESSY LOUIS VUITTON SE (MC) announced that it will propose a dividend of 13 euros per share at the general meeting. A dividend deposit has been distributed. The balance will be paid.";positive
15/04/24 02:00;LVMH MOËT HENNESSY LOUIS VUITTON SE (MC);Textile Habillement Accessoires;LVMH: Revenues down by 10% in the first quarter of 2024, worried investors.;LVMH MOËT HENNESSY LOUIS VUITTON SE (MC) posted a significant decrease in its consolidated turnover in the first quarter of 2024, recording a decrease of around 10% in comparison with the previous year. This performance is mainly due to a marked decline in some of its iconic brands, particularly in Asia-Pacific. The turnover of some of its brands is expected to fall by almost 20% in comparison to March 31st. Moreover, the combined effect on the published turnover of the positive contribution from recent acquisitions and the negative impact of exchange rates is estimated to be around -1% to -2%. LVMH MOËT HENNESSY LOUIS VUITTON SE (MC) will announce its turnover for the first quarter of 2024 on April 23rd after the stock exchange. This announcement leads to a fall in the price of LVMH share, currently at €868.11, in a context where luxury values are particularly scrutinized. Investors are concerned about this downward trend that affects the entire sector.;negative
13/12/24 01:00;L'ORÉAL (OR);Chimie Pharmacie Cosmétiques;L'ORÉAL : The analysis office confirms its advice on the purchase with a course target of 300 €;The analysis office confirms its advice on buying and its target price of €300 after the publication of the figures of the 3rd quarter. After the performance of the 1st quarter, we are recording our forecast of sales of L'ORÉAL by +2%-3% for a profit per share (BPA) of +5%-6%, with prospects that should be noted in the 2nd quarter from a slight decline to potential growth, according to us, on the basis of a greater precision of the supply of raw materials and the expansion of the range of hair care products in the United States. 'We believe that the quality of the ORÉAL product portfolio remains underestimated, with many innovations being developed this year to gradually strengthen confidence, although the conclusion of some research and development projects in the 3rd quarter seems uncertain, but probably remains in favour of the risk/reward ratio of the action: +4%-6% against -1%-2%', adds the analytical office. With a current price at €262.13 and annual revenues constantly increasing (€41.18 billion in 2023), the ORÉAL seems well positioned to continue to show solid growth in the coming quarters. The firm's strong financial performance, with a net profit of €6.18 billion in 2023, strengthens investors' confidence in L'ORÉAL's ability to maintain a positive growth path.;positive
26/02/25 01:00;L'ORÉAL (OR);Chimie Pharmacie Cosmétiques;L'Oréal: Return on net income and revenue in 2023, but a dividend maintained.;"L'Oréal announces a net income share of the group in decline from 6.5% in 2023 to 6.18 billion euros, for a revenue decrease from 3.2% to 41.18 billion euros. The world leader in cosmetics invokes a decrease in volumes ""mainly on sales of non-strategic products"" and a negative exchange effect. It will propose the distribution of a dividend of 4.80 euros per share paid on 5 June. In 2024, the evolution of the sales and profitability of the group will depend ""on the level of demand in the various markets, the launch of new products and the evolution of the world economic situation"", announces L'Oréal.";negative
19/11/24 01:00;HERMÈS INTERNATIONAL (RMS);Textile Habillement Accessoires;Hermès International : Le Luxe Resistes and Folds Records with a Business Number of 15.17 Billion!;HERMÈS INTERNATIONAL (RMS): The trend is up in the short term. The title of the French luxury giant is back in colour. The title continues to grow in depth, even though the general environment is in distrust, driven by solid financial results. Indeed, the company's latest annual revenues show a remarkable increase, with a total turnover of 15.17 billion euros in 2024, and a net profit of 4.60 billion euros over the same period. What scenario is to be preferred to accompany this growth? by Daniel Cohen de Lara, President of AFATE.;positive
26/04/25 02:00;HERMÈS INTERNATIONAL (RMS);Textile Habillement Accessoires;Hermès at the top of the loss in luxury: analysts are looking down on their price targets!;HERMÈS INTERNATIONAL (RMS) : The luxury sector is in the red, Hermès in the lead. The group's fundamental performance and low-denominated stock market performance have led to a series of poor performances despite its solid figures. As a result, the financial analysts have lowered their price targets due to lower than expected revenue growth and net profit. As an indication, the current price of € 255.18 is considered high in relation to the results of the last financial years, notably with a net profit of € 4.6 billion for a turnover of € 15.17 billion as at 31 December 2024. What are the new objectives to be met?;negative
18/05/25 02:00;TOTALENERGIES SE (TTE);Energie et Produits de base;"""TotalEnergies: indicators for the first quarter of 2024 show promising stability and growth""";TOTALENERGIES SE (TTE) has published its main indicators for the first quarter of 2024. Oil production is expected to be stable, above 2.45 million barrels of oil equivalent per day, despite the actual disposal of unspecified assets in the fourth quarter of 2023, driven by the increase in LNG production and the start-up of new projects. Integrated Power's results are expected to rise thanks to the growth of the activity. Moreover, the oil group indicates that its European refining margin indicator increased sequentially to $71.7 per tonne in the first quarter of 2024, compared with $52.6 in the fourth quarter of 2023. The results of the Aval will reflect the increase in refining margins, with the refinery utilization rate in the first quarter of 2024 being broadly stable compared to the fourth quarter of 2023. Given the low volatility in the first quarter of 2024, the results of oil and LNG trading are expected in the historical average. This positive trend is expected to contribute to a strong financial performance for the company, which has already demonstrated its ability to generate significant revenues, with a total turnover of $218,945 billion in 2023 and a net profit of $21,384 billion.;positive
25/02/25 01:00;TOTALENERGIES SE (TTE);Energie et Produits de base;TotalEnergies: the high-voltage general meeting of climate activists and shareholders;"TOTALENERGIES SE (TTE) is preparing for a new general assembly under tension, which the demonstrators of the climate cause would be well shaken Friday at the moment when shareholders have to decide on the climate issues and the renewal of the CEO Patrick Pouyanné. For the first time in two decades, the fourth world oil major and largest French company by profit, which celebrates this year a new stage of its development, will hold its annual Grand Mass at home, in its 48-storey tower in La Défense, rather than in a room in the middle of Paris. Objective: to avoid ""immobilize a district of Paris"", explains the group, as it had happened during a tumultuous 2023 edition, marked by warm-ups between demonstrators and police officers on the outskirts of the hall hosting the event. A year later, the pressure did not fall. In the streets or in court, the group remains under the fire of critics of climate advocates, who accuse it of aggravating global warming and harming biodiversity and human rights, as a result of its activities in gas and oil. Organizations have explicitly called for a push to the AG. Among them, the Extinction Rebellion movement, which requires the ""abandonment"" of flagship projects in Uganda/Tanzania, Mozambique and Papua New Guinea, and, as advocated by the International Energy Agency, ""the cessation of any investment in new fossil projects"". Between ""300 and 600"" protesters are expected, according to a police source. ""A big device"" is planned, the source said, which expects like last year to face confrontations between ecologists and shareholders. Faced with the ""risk"" of disturbances to public order, the police prefect of Paris took a decree prohibiting undeclared demonstrations in a perimeter around the Tour Coupole. On the agenda, shareholders, present or online, will be called to vote on the climate strategy of TOTALENERGIES SE (TTE), some investors also demanding a more ambitious energy transition. Tuesday, 22% of Shell's shareholders rejected its climate plan, a relatively high proportion. Last year, at TOTALENERGIES SE (TTE) a purely consultative resolution from militant shareholders had even won 30.4% of the votes. It called on the company to align its greenhouse gas emission reduction targets with the 2015 Paris Agreement, to limit global warming to +1.5°C compared to the pre-industrial era (the world is already at about 1.2°C). The President and CEO of TOTALENERGIES SE (TTE), Patrick Pouyanné, spoke at a session of the Qatar Economic Forum in Doha on 15 May 2024. This time, no consultative resolution is expected. A coalition of shareholders claiming 0.9% of the capital demanded in vain, until the court, a non-binding resolution aimed at ""discontinuing the cumulation of the functions of president and general manager"" held by Patrick Pouyanné, to keep him in the position of general manager. An unthinkable choice for the board of directors, attached to the ""strategic stability"" of the company that earned $21.4 billion in profits in 2023, after $20.5 billion in 2022, and 16.03 billion in 2021, and will propose to shareholders to renew the CEO for a fourth term. The hot leader of the company for the past 10 years will preside this meeting on the background of controversy after his statements on a possible relocation of the main listing of the Paris group to the New York Stock Exchange. From the comments that triggered the lightnings of the political class, from Bruno Le Maire to Emmanuel Macron. As to appease the criticisms, he mentioned on Thursday in Le Figaro a ""translation error"": he did not want to talk about a main quotation on Wall Street but about a transformation into classic shares of the securities already traded in a form reserved for foreign companies. Mr Pouyanné pointed out that the Americans buy more shares than the Europeans, more constrained by rules of sustainable investment. The CEO repeats it, TOTALENERGIES SE (TTE) is ""the oil group most involved in the energy transition"". A third of its investments are devoted to low-carbon energy, 95% of which is renewable electricity. But in September, the think tank Carbon Tracker estimated that ""only"" the Italian oil company Eni had emission reduction targets ""potentially"" aligned with the Paris agreement. TOTALENERGIES SE (TTE) came second before Repsol and BP, far ahead of the Saudi Aramco or the American ExxonMobil.";negative
22/08/24 02:00;SANOFI (SAN);Chimie Pharmacie Cosmétiques;Sanofi : Barclays raises its target course and confirms its recommendation for purchase;SANOFI (SAN) is appreciating slightly in Paris, following Barclays' confirmation of its recommendation 'weight online' on the title, with an adjusted price target to reflect the new growth prospects. The analyst has revised his forecast of operational expenditure for SANOFI, integrating the latest trends in the health sector. Sales estimates for certain key drugs, such as those in the SANOFI portfolio, have been adjusted to anticipate prolonged growth until 2033, thus benefiting from long-term visibility. In addition, the results forecasts for the first quarter have been updated to reflect current market conditions. Barclays is now aligned with the consensus of analysts and plans performance for 2024 above SANOFI's targets, demonstrating renewed confidence in the company's ability to deliver strong results.;positive
24/11/24 01:00;SANOFI (SAN);Chimie Pharmacie Cosmétiques;Sanofi announced a decrease in net income and revenue in the first quarter of 2024.;Sanofi reveals a net decrease of 12.1% to 556 million euros in the first quarter of 2024, i.e. 4.44 euros per share, as well as an EBITDA down from 3.2% to 1.33 billion euros, i.e. a slight increase in EBITDA margin from 0.3 points to 23.1%. Revenue decreased from 5.5% to 11.07 billion euros, with a slight increase in volumes, but a negative price effect reflecting mainly the pressure on the prices of certain medicines and the still unfavourable market conditions in certain therapeutic areas. Sanofi has focused on strictly managing its operations and making progress in carrying out its main projects in progress in order to reap the first benefits in the spring, says its CEO Paul Hudson. The health group confirms its target for the year 2024 of an estimated EBITDA of between EUR 10.5 billion and EUR 11.5 billion, 'depending on the level of demand recovery, and with a more weighted seasonality on the second part of the year'.;negative
05/08/25 02:00;AIRBUS SE (AIR);Aéronautique Espace Armement;Breeze Airways orders an additional 10 A220-300 aircraft from Airbus SE.;We are pleased to announce that a leading airline, Breeze Airways, has placed an additional 10 A220-300 aircraft on Airbus SE. This new order brings Breeze's total firm orders for this type of aircraft to 90, making it one of Airbus SE's leading customers for the A220. Breeze Airways has also confirmed its commitment to use a fleet entirely composed of Airbus A220 for its commercial operations by the end of 2024. It should be noted that Breeze Airways had received the delivery of its first Airbus A220 in December 2021 and is currently operating 20 aircraft across the United States. This new order demonstrates the airline's confidence in Airbus SE's products and confirms the company's position as a leader in the aviation sector. Thanks to its innovative and efficient product range, Airbus SE continues to meet the needs of airlines and their passengers. Airbus SE's revenues have continued to grow in recent years, with a total turnover of 69.23 billion euros in 2024, while the company's net profit has also increased to 4.23 billion euros in 2024.;positive
14/06/25 02:00;AIRBUS SE (AIR);Aéronautique Espace Armement;"""Airbus SE: The downward trend continues, attention to oblique resistance""";Shareholders of Airbus SE (AIR), We inform you of a worrying situation regarding the evolution of the price of our share. Of the last 5 sessions, the price of the Airbus SE share has shown a notable decrease of -5%, showing an unencouraging graphic structure. This pattern is not isolated, since we have observed since mid-October a trend to significant increases of +5 or +6% in 4 or 5 sessions, followed by equivalent and rapid relapses. It is crucial to closely monitor the technical situation, especially the slash resistance (basis) which currently stands at around 555 €, close to the current price. The test of the level of support at 540 € could be in sight, if the downward trend continues. We invite you to remain vigilant in this situation and to follow the recommendations of our management and analysis teams to adjust your strategies accordingly. This follow-up will be maintained and additional information will be communicated to you if necessary.;negative
14/02/25 01:00;SCHNEIDER ELECTRIC SE (SU);Electricité Electronique;Schneider Electric in negotiations to acquire Preligens, specialist in artificial intelligence for 220 million euros.;"SCHNEIDER ELECTRIC SE (SU), a leader in the field of energy and industrial automation, announces that it is in the process of discussions to acquire 100% of Preligens' capital, a specialist in artificial intelligence (IA) dedicated to the energy and industry industries 4.0. Preligens' value is estimated at 220 million euros. This acquisition would represent for SCHNEIDER ELECTRIC SE (SU) ""a unique opportunity to add AI capabilities to its offer at the state of the art, while accelerating the roadmap of its digital transformation, in particular that applied to Industry 4.0"". With its international presence, SCHNEIDER ELECTRIC SE (SU) would also support the development of Preligens in the world, particularly in the US market. Preligens, based in France, achieved a turnover of 28 million euros in 2023 and employs 220 employees, including 140 engineers for the research and development division. Founded in 2016, Preligens offers proven AI-based solutions to analyze complex industrial data. Preligens' acquisition would speed up the adoption of AI within the group, thus optimizing our agility and efficiency. With multiple applications, this contribution would represent a major step in the development of our activities in energy and industry 4.0, and would also allow us to deploy digital inspection methods to enhance the quality and safety of industrial operations. This operation is subject to the usual regulatory approvals, as well as to the procedures applicable in terms of information and consultation of Preligens staff representatives. Its completion is expected in the third quarter of 2024. ""We are convinced that the acquisition of Preligens will be an important step for our company, allowing us to increase our expertise in artificial intelligence and to strengthen our position in the energy and industry market 4.0"", says a spokesperson for SCHNEIDER ELECTRIC SE (SU). SCHNEIDER ELECTRIC SE (SU) achieved a turnover of 35.9 billion euros in 2023 and employs more than 29 000 people worldwide. This acquisition is part of the group's growth and innovation strategy, which has already invested significantly in the research and development of intelligent energy and industrial solutions.";positive
15/08/24 02:00;SCHNEIDER ELECTRIC SE (SU);Electricité Electronique;Schneider Electric forecasts a stable turnover for 2024-25 despite an expected decline in the first half of the year.;SCHNEIDER ELECTRIC SE (SU) announces a stable turnover for the financial year 2024-25 at constant scope and exchange rates, with potential for an increase if activity in the energy sector recovers earlier than expected and with a strong seasonality effect during the financial year. The turnover in the first half of 2024-25 is expected to decrease by about 15% in organic and annual terms, before a rebound in the second half of the year, taking into account the current trend in annual revenues of EUR 35,902 billion in 2023-24. The EBITDA margin for the financial year is expected to fall to about 35%, similar to that of the previous year when the profit margin was strong despite a decrease in revenues. For the financial year 2023-24, SCHNEIDER ELECTRIC SE (SU) confirmed that it expected a decrease of around 10% in organic sales, a performance slightly lower than the EUR 35,902 billion of the previous year, but an EBITDA margin of about 34% is maintained, as indicated above.;negative
24/10/24 02:00;AIR LIQUIDE (AI);Energie et Produits de base;"""AIR LIQUIDE and Dunkirk LNG win EU support for the Artagnan CO2 capture and export project""";AIR LIQUIDE is proud to announce that the European Commission has decided to support the D'Artagnan project, an innovative transport and export infrastructure for CO2, initiated in partnership with Dunkirk LNG. This ambitious project aims to significantly reduce greenhouse gas emissions in the Dunkirk basin. As part of this project, AIR LIQUIDE will contribute to the creation of a specialized pipeline for the transport of CO2 from the capture sites to a terminal located in the port of Dunkirk. From this terminal, CO2 will be liquefied and then loaded on LNG vessels to be exported. This project represents a major investment estimated at more than 400 million euros. It is noteworthy that D'Artagnan is the first CO2 infrastructure project in France to benefit from the financial support of the European Union. As part of the CEF-E (Connecting Europe Facility - Energy) funding programme, the project is eligible for a grant of more than EUR 160 million, subject to the actual implementation of the project. This initiative is perfectly in line with the strategy of AIR LIQUIDE to reduce its carbon footprint and promote more sustainable energy solutions. By partnering with Dunkerque LNG for this innovative project, AIR LIQUIDE reaffirms its commitment to the energy transition and the fight against climate change. The recent financial results of AIR LIQUIDE, with a total turnover of EUR 27.058 billion and a net profit of EUR 3.306 billion as at 31 December 2024, demonstrate the financial strength of the group. This solid financial situation allows AIR LIQUIDE to invest in strategic projects such as D'Artagnan, thus contributing to a more sustainable future. AIR LIQUIDE is delighted with this opportunity which not only strengthens its position as a leader in the industrial gas sector but also illustrates its active role in reducing CO2 emissions and promoting sustainable energy practices.;positive
07/02/25 01:00;AIR LIQUIDE (AI);Energie et Produits de base;The Paris Stock Exchange is falling, driven by Air Liquide's disappointing results.;"The Paris Stock Exchange ended in decline by 0.42% on Wednesday, following a session marked by a decline in the title of AIR LIQUIDE, whose results were considered disappointing, despite a record net profit. The leading index CAC40 fell by 32.15 points to 7.596.36 points. On Tuesday, it had increased by 0.65%, supported by a surprise rebound of industrial orders in Germany. The session was marked by the sharp drop of AIR LIQUIDE which abandoned 3.50% to 542.52 euros. The French industrial gas giant achieved in 2023 a record net profit of 3,3061 billion euros, up 7.4% over a year. This growth is in the wrong direction because it benefits from a favourable comparison against the result of last year. Its adjusted profit thus fell by 2.5% to 3,078 billion euros, compared to 2022. The fourth quarter results were also slightly lower than the analysts' forecasts surveyed by Bloomberg. On the macroeconomic level, ""there is always a form of attentism on the markets as regards the expectations of monetary policy"" of the central banks, comments Nathalie Benatia, macro economist of Bnp Paribas AM. ""The most interesting element for economists is the interview of Isabel Schnabel (member of the Executive Board of the European Central Bank, NDLR) at the Financial Times, who wants to convince observers that the ECB will not lower its rates as quickly"" as anticipated by the markets, continues the analyst. Inflation in the services sector is still high, a resilient labour market and geopolitical tensions are prompting prudence as regards a further fall in rates expected by the markets in April. AIR LIQUIDE also announced that it plans to revise its growth forecasts for 2024 downwards due to more difficult market conditions than expected. The group confirmed that its turnover 2023 amounted to EUR 27,058 billion, down 2% from 2022.";negative
