date;ticker;sector;title;content;sentiment
17/02/25 01:00;ESSILORLUXOTTICA (EL);Biens d'équipement domestique;ESSILORLUXOTTICA decreased after HSBC degradation, but long-term prospects remain strong;"ESSILORLUXOTTICA (EL) recorded a decrease from 2.22% to 70.49 euros, one of the largest market declines, following a deterioration of HSBC. In its analysis note, the bank decided to buy to conserve on the title of the French-Italian telescope while lowering its price target. ""We lower our profit estimates for the financial year 2024-2025 by 2% due to a lower EBIT margin than expected last year"", explains the bank to justify its change of recommendation. The visibility and short-term growth of ESSILORLUXOTTICA is somewhat more blurred and the shares have performed well (up from the lowest) , but HSBC expects better growth in the medium term, fuelled by its constant product innovations (myopia, transition lenses, hearing aids). Regarding organic sales growth in the first quarter of 2024, HSBC believes that for the multinational, this period could be the least dynamic quarter of the year. The bank is thus based on organic growth of 4.9%, and an increase at constant exchange rate. In addition, ESSILORLUXOTTICA tends to increase prices only through the product mix, but it seems that the company will carry out a little more pure price increases this year, which are expected to materialize towards the end of the second quarter of 2024. In addition to this deterioration of HSBC, this Tuesday, ESSILORLUXOTTICA announced new developments in its strategic expansion, thus strengthening its position on the market. Investors can be pleased with the positive long-term dynamic of the company given its latest solid results with a total revenue of 26508000000.0 and a NetIncome of 2359000000.0.";positive
02/03/25 01:00;ESSILORLUXOTTICA (EL);Biens d'équipement domestique;ESSILORLUXOTTICA: Turnover 2023 down 4.5% despite an increase in net profit.;ESSILORLUXOTTICA (EL) announced a decline in its overall turnover in 2023 from 4.5% to 25.31 billion euros, despite a net profit which continues to increase. Its sales in Europe, which represent 40% of turnover, declined by 2.1% and those internationally by 6.3%. One year earlier, the company had already experienced a decrease of 0.5% in its turnover, but had seen its net profit increase by 15.5%. Sales of optical products, which represent 80% of turnover, show a decrease of 3.2%, compared with a decrease of almost 10% for sales of bezel products. With 15 closures of stores recorded during the year, ESSILORLUXOTTICA has only 850 of them. The company is shaken like the whole sector of the optics by the inflationary wave which started in 2022. The group will present on 12 March its annual results 2023 and its medium-term transformation plan. This announcement could impact the price of the action which is currently at €79.17, after having reached record levels of net profit in recent years, notably with a net profit of €2.359 billion in 2024, according to the latest figures available.;negative
08/01/25 01:00;BNP PARIBAS (BNP);Banque;BNP Paribas transfers its online banking subsidiary to focus on its core business.;"BNP Paribas has entered into an exclusive agreement with the Danish group Ageras to divest its online banking subsidiary for entrepreneurs and independents. On the Stock Exchange, the bank's share loses 0.85% to 519.25 euros within a slightly growing sector in Paris. No financial details have been given about this transaction. BNP Paribas had developed this activity internally in recent years to meet the growing needs of professionals. This divestment project is helping to simplify BNP Paribas"", explained the banking group. ""It allows the group to refocus on its retail banking network in France, as well as on specialized banking services, to continue to grow in the customer segment of professionals and improve its financial performance."" The project is expected to be completed in the first half of 2025. BNP Paribas' strategic roadmap, presented in 2023, aims to ""shape a simplified, more synergistic and efficient model while strengthening the Group's capital."" With annual revenues of 65.87 billion euros in 2024 and a net profit of 11.688 billion euros, BNP Paribas is confident in its ability to strengthen its solvency ratio and continue its growth path. At the same time, BNP Paribas recently announced several initiatives to adapt its offer to the changing needs of its customers, particularly in the area of online banking and specialized banking services. This divestment is part of the Group's strategy to focus on its core activities and strengthen its position on the market.";positive
02/03/25 01:00;BNP PARIBAS (BNP);Banque;"""BNP Paribas: Results of the fourth quarter below expectations, impacted by extraordinary provisions""";BNP PARIBAS announces results for the fourth quarter below expectations, with a net share of €1.169 billion, down 50% from the €2.34 billion consensus. This is mainly due to extraordinary negative elements, including extraordinary provisions for disputes related to the mortgage portfolios of Personal Finance and Poland, which amount to €320 million and €221 million respectively. Gross operating income fell from 8.8% to €3.486 billion, while the risk cost increased from 39.4% to -972 million. Net banking income increased by 0.1% to 11.43 billion, but management costs increased by 4.2%. The bank announced a 2023 dividend of €4.81 in cash, up 18%, and a share buyback program of €1.05 billion in 2024. BNP PARIBAS's hard equity ratio (CET1) stood at 13.2%, up 90 basis points over the year. Regarding the outlook, the bank forecasts a return on tangible equity (ROTE) by 2025 between 11.5% and 12%, but targets a ROTE of 12% by 2026.;negative
09/05/24 02:00;KERING (KER);Textile Habillement Accessoires;Oddo BHF is increasing its price target for KERING to €509.77, anticipating an organic growth of 8% by 2025.;Oddo BHF maintains a positive analysis on KERING with a price target adjusted to €509.77, reflecting an upward revision of the estimates and the more favourable market conditions. As a reminder, KERING published annual revenues of €17,194 million in 2024, showing growth that demonstrates its strong position on the market. EBIT 2024 stands at €1,133 million, with a margin of 6.6% that reflects a strong operational performance. Our initial revenue and EBIT 2024 forecasts were respectively €16,860 million and €1,050 million. In this context, Oddo BHF revises its organic growth forecast for 2025, expected to be 8%, and adjusts its EBIT forecasts accordingly, now anticipating an EBIT margin of 7.1% for 2025. This revision implies a 5% increase in EBIT forecasts for 2025.;positive
08/12/24 01:00;KERING (KER);Textile Habillement Accessoires;Oddo BHF maintains a 'neutral' rating on Kering with a price target lowered to 412 euros.;Oddo BHF confirms its 'neutral' rating on the Kering title with a lower price target of 423 to 412 euros. Yesterday, the luxury group published a turnover of 2023 to 19 566 million euros, i.e. -2% in organic and an EBIT of 4 746 million euros, i.e. a margin of 24.3% (vs 27.5% for 2022). 'We estimate on 19,416 million euros and 4,843 million euros (margin to 24.9%) respectively', recalls Oddo BHF, which evokes a turnover in the 4th quarter 'ternal but under control', to -4% tcc. The analyst indicates that he has slightly adjusted his organic group growth forecast from 3.8% to 3.2% out of 2024. For 2025, our group turnover forecast reflects an organic growth of 6.8% (unchanged) with an EBIT margin of 23.4% (vs 25.2% prec). The broker reports that Kering is planning a decline in EBIT 2024 in view of the efforts undertaken to support and revive the brands and in particular Gucci that Oddo BHF considers 'always in transition'. Oddo BHF thus evokes a significant adjustment of EBIT forecasts to -8% for 2024 and -7% for 2025, while Kering's latest annual revenues were 19,566 million euros in 2023 and 17,194 million euros in 2024, with net profits of 2,983 million euros in 2023 and 1,133 million euros in 2024.;negative
08/12/24 01:00;VINCI (DG);BTP Génie Civil;"""VINCI shows results 2023 up sharply and optimizes its dividend""";VINCI (DG) has revealed results of 2023 with a sharp improvement. The construction and services group has a net profit of 4,863 billion euros compared to 4,702 billion euros in 2022. The current operating income increased from 10.2% to 7,278 billion euros, i.e. a current operating margin of 10% compared to 9.5% in 2022. The turnover increased by 4.2% on a perimeter comparable to 69,885 billion euros. The net cash flow of debt amounts to EUR 12.1 billion compared to EUR 9.5 billion at the end of 2022. The Board of Directors will propose at the annual general meeting to be held on June 5th to distribute a dividend for fiscal year 2023, reflecting the group's confidence in its ability to generate solid and stable cash flows. In view of the evolution of the market at the end of February, VINCI anticipates a moderate growth in its production of 2024, in line with the trends observed in 2023. The efforts to optimize the cost structure are continuing and are expected to contribute to an operating profitability maintained around 10% of the year's turnover.;positive
13/09/25 02:00;VINCI (DG);BTP Génie Civil;The Court of Cassation confirms the sanction against Bloomberg in the case of the false press release VINCI.;The Court of Cassation rejected Bloomberg's appeal in the case of the false press release concerning VINCI (DG), our company. In November 2016, Bloomberg had issued incorrect information by relaying the content of a false press release concerning us, causing a fall in our price of 18.28 % before a partial recovery. This case had already resulted in a penalty of 5 million euros from the Autorité des marchés financiers (AMF), reduced to 3 million euros in 2021 by the Court of Appeal of Paris. The Court of Cassation confirmed this sanction, considering that Bloomberg had failed to comply with the rules of his profession by disseminating this information without sufficient verification. We assessed the damage suffered to investors to 6.5 million euros. Our closing price had finally dropped by 3.78% on that day. Our financial statements for the last few years show that our turnover has continued to grow (€50.23 billion in 2021, €62.51 billion in 2022, €69.88 billion in 2023 and €72.77 billion in 2024) despite this event. Our net result has also continued to grow (€2.597 billion in 2021, €4.259 billion in 2022, €4.702 billion in 2023 and €4.863 billion in 2024). We are pleased that this business is now closed and we are focusing on our business, with a current price of €175.12.;negative
13/05/25 02:00;AXA (CS);Banque;AXA reaches a new annual record at €730.00, towards an absolute record?;AXA (CS) is embedded in a 5-week bullish funicular: the title testes €730.00, new annual record and best brand since the record close of 13/02/23 (€729.50). AXA (CS) surpasses the zenith of €724.50 of 27/02/23 and will try to establish a new absolute record, beyond €735.00 (in intraday on 10 February 2022 and then €730.50 in closing).;positive
23/12/24 01:00;AXA (CS);Banque;"""AXA plans to abolish 900 posts in France to reach €1.7 billion in savings by 2026""";"Three days before the publication of its annual results, AXA (CS) unveiled a plan to reorganise its headquarters in France, which will result in the abolition of 900 posts, or about 5% of the headquarters' staff. On the Stock Exchange, AXA's share (CS) loses 2.01% to 880.42 euros. On the occasion of the presentation of its strategic plan in September, which had been welcomed, the Director General had announced around 1.7 billion euros of savings by 2026, including 700 million euros of additional savings. This reorganization project, which would ""constitute an important step in the realization of the envisaged additional savings"", aims to ""simplify its operation and structurally improve its operational efficiency"". AXA (CS) wants to ""regroup and pool certain activities and functions"" and ""remove hierarchical layers to alleviate decision-making processes."" These cost reductions should allow the operating coefficient - measures the operational efficiency of the company - to fall to less than 60% in 2026 against an operating coefficient 2023 of 94.1% ( 86.015.000.000 / 91.483.000.000 ). It specifies that it will deploy ""all the accompanying measures in force in its social pact through internal mobilitys, transitions of activity or voluntary departures"". The AXA Group employs almost 49,000 employees worldwide according to its annual report 2023 . This reorganization dossier is submitted today to the consultation of the bodies representing the staff, the outcome of which is planned in the second quarter of 2024. AXA (CS) will publish its annual results on Thursday, February 8.";negative
26/01/25 01:00;SAFRAN (SAF);Electricité Electronique;SAFRAN and Exail Technologies join forces to revolutionize cab connectivity with the WIZY-WAP.;SAFRAN announces that it has signed a first partnership with Exail Technologies for the WIZY-WAP, the latest generation of on-board communications equipment, which is expected to generate an annual turnover of several million euros. Exail has selected SAFRAN to integrate this new solution into its cabin connectivity system for commercial aviation. WIZY-WAP will be integrated into both the new aircraft and the retrofit of SAFRAN's current fleet. This partnership is a new step in the development of SAFRAN's connectivity product range, which has already contributed to a significant increase in the company's turnover, from 15 133 million euros in 2021 to 23 651 million euros in 2023. This financial growth reflects the positive momentum of the group, which also returned to profits in 2023, showing a net profit of 3,444 million euros, after a loss of 2,459 million euros in 2022. This strategic partnership strengthens SAFRAN's position in the commercial aviation market and confirms its commitment to offer innovative and efficient solutions to its customers.;positive
27/08/24 02:00;SAFRAN (SAF);Electricité Electronique;SAFRAN unscrews by 8.12% after disappointing guidance for 2024-2025!;"SAFRAN's sharpest decline in the SBF120 index is from 8.12% to 496.99 euros after revealing its guidelines for the financial year 2024-2025. ""These are very disappointing, again shifting the recovery of the market"", comments Invest Securities. SAFRAN expects turnover to increase slightly by 2% at constant scope and exchange rates, to reach around 24 billion euros, ""with a potential increase if aviation activity recovers earlier than expected and with a strong seasonality effect during the financial year."" In detail, the turnover of the first half of the year is expected to decrease by about 5% at constant scope and exchange rates, with a low point expected in the 1st quarter of 2024-2025 due to delays in the delivery of certain components. The manufacturer of aeronautical components then anticipates a rebound in turnover in the second half of the year, in particular ""covered by the end of the correction of the stocks in the foundries and a sustained commercial activity"". Ebitda's margin for the financial year 2024-2025 is expected to be around 27%, down from that of the previous year. SAFRAN confirmed that it was waiting for the financial year 2023-2024 for a turnover increase of about 13% at constant scope and exchange rates, to reach about 23.65 billion euros, and an Ebitda margin of about 29%, according to the indications given on 7 February last, despite a net loss of 2.46 billion euros in 2022-2023. Results 2023-2024 will be published on 22 May next.";negative
19/05/25 02:00;PERNOD RICARD (RI);Agroalimentaire;"""Wellington Management Group exceeds 5% of Pernod Ricard's capital, a sign of confidence in the future of the company""";Wellington Management Group, acting on behalf of funds and customers, reported to the AMF that on 15 February 2024 it had crossed the 5% threshold of the capital of Pernod Ricard (RI), and held, on behalf of the said funds and customers, 5.05% of the capital and 4.22% of the voting rights of that company. This threshold was the result of an acquisition of shares Pernod Ricard (RI) in the market, reflecting investor confidence in the financial soundness and growth prospects of the company, which recently published solid results with a total turnover of 11.598 billion euros and a net profit of 1.476 billion euros as at 30 June 2024. This increased participation of Wellington Management Group reflects a positive vision of the future of Pernod Ricard (RI), whose shares are currently valued at 330.97 euros.;positive
15/11/24 01:00;PERNOD RICARD (RI);Agroalimentaire;Pernod Ricard: revenue down 1% in the third quarter, financial targets adjusted downwards;"Pernod Ricard announced a decrease of 1% in comparable figures for its third quarter, to €2.9 billion, a decrease of €116 million compared to the same period of the previous year. ""The pressure on consumption in the Europe area, as well as in certain regions of America and Asia, led to a decrease in sales volumes during the period, particularly marked in the large distribution, both for our brands and for brands of distributors,"" the group said in a press release. In this context, Pernod Ricard adjusted its sales growth target for the year to a decrease of 2% to 3%, compared with an initial forecast of 5%. However, the group confirms its objective of increasing current operating income, which is expected to increase by about 10%, in line with market expectations. This downward revision of its financial targets reflects the challenges Pernod Ricard faces in a difficult economic environment.";negative
06/11/24 01:00;DASSAULT SYSTÈMES SE (DSY);Services informatiques;DASSAULT SYSTEMS SE strengthens its cloud computing infrastructure in Île-de-France with a new region of availability.;DASSAULT SYSTEMS SE announces the launch of a new region of availability in Île-de-France, thus strengthening its cloud computing infrastructure to offer a robust presence in three geographically close data centers, guaranteeing resilience and low latency times. This strategic location, located near Paris, allows DASSAULT SYSTEMS SE to offer its customers a solution that allows them to benefit from replicated data for almost instantaneous or distributed changeovers for scale-up, thus providing increased resilience. This initiative is in line with our strategy to expand and diversify our cloud offerings, while new regions are expected to be deployed in the coming years. We are convinced that this development will allow us to better meet the needs of our customers and strengthen our position in the market. With a turnover of €6.21 billion in 2024 and a net profit of €1.20 billion, DASSAULT SYSTEMS SE has the resources to invest in strategic initiatives such as this one, thereby strengthening its leadership in the software and cloud computing sector.;positive
02/06/24 02:00;DASSAULT SYSTÈMES SE (DSY);Services informatiques;"""DSY collapses by 30% in 48 hours, investors worried about a possible ultra-dilutive capital increase""";Investors react very negatively to the 2 revised proposals for financial restructuring, from DSY associated with a number of investors on the one hand, and from a consortium composed of some current and potential shareholders on the other hand. Dassault Systèmes SE, which is deviating by -16%, sinks its 'absolute low' of €275.5 on 21 and 25 March and collapses from -30% in 48H, under €232, towards a new 'lower' of €218, which seems to integrate the prospect of an ultra-dilutive capital increase. And the session is not over: a split by 2 in less than 1 month compared to the recent zenith of €390/395 cannot be excluded, i.e. a target of €165.625/182.5, given that its net income has increased by 55% in 4 years, investors are worried that this title will reach such thresholds while its CA has increased by only 28% over the same period.;negative
03/08/25 02:00;STELLANTIS N.V. (STLAM);Automobile;"""UBS goes to 'neutral' on Stellantis and raises its target price to 300 euros""";"UBS announced on Friday that it had moved to a 'neutral' opinion on the Stellantis title, against a 'sell' advice previously, with a price target raised from 31 to 50 euros, i.e. a target adjusted to 300 euros, on the basis of our internal growth projections, taking into account the current multiples of the sector. The broker explains that after the cancellation of some projects and the Brussels survey on Chinese electric cars, it envisages a 'interesting' redistribution of liquidity to shareholders. According to its calculations, Stellantis should be one of the groups in the sector to display a good financial dynamic this year, with revenues amounting to 156.878 billion euros in the last financial year. Note that the company's net profit amounted to 5.473 billion euros over the same period. ""After a solid first quarter, we are more confident about Stellantis' ability to achieve its financial objectives this year,"" he says. ""The broker's only reservation, according to him, is that some strategic directions - which do not aim at operational balance before next year - are holding back possible returns to shareholders. Stellantis' title was exchanged at 245.45 euros at the opening of the stock market session.";positive
26/06/25 02:00;STELLANTIS N.V. (STLAM);Automobile;Deutsche Bank adjusts its price target on Stellantis to 32 euros, however confirming its purchase recommendation.;Deutsche Bank announced on Thursday that it had reduced its target price on STELLANTIS N.V. (STLAM) from 38 to 32 euros, while maintaining a recommendation for purchase on the title. In a research note, the intermediary states that it is expected that the car manufacturer, well known for controlling its costs, will begin to be affected by a number of difficulties, notably after publishing a net profit of 5.47 billion euros over the last 12 months, a significant decrease compared to 18.596 billion euros of the previous year. In his view, the fourth quarter performance, which will be published on 15 February, should thus be penalized by a less favourable 'mix' and by negative exchange rate effects, which are expected to weigh on the margins until the second half of the year, while turnover has also fallen from 189.544 billion euros last year to 156.878 billion euros over the last 12 months. However, with regard to its outlook for 2024, Deutsche Bank expects STELTANTIS N.V. (STLAM) to stick to its objective of a two-digit adjusted operating margin and a positive cash flow available in its industrial activities, despite the rise in wage costs, lower price effects and low sales volumes. The analyst believes that the builder will also maintain the broad outlines of his capital redistribution program for its shareholders.;negative
07/10/23 02:00;DANONE (BN);Agroalimentaire;Danone had a turnover of 27,376 billion euros in 2024, up 1.2%.;DANONE announces that it has achieved a total turnover increase of 1.2% to 27,376 billion euros in its financial year 2024, including a dairy product activity increasing from 1% to 20,21 billion euros, in line with the Group's expectations. Against the background of a slight decrease in volumes on the dairy products market, the Group's strategic repositioning on premium segments and the solid evolution of specialised nutrition activity have thus achieved a slight increase in turnover, even if the original ambition was to aim for a 5% growth. This performance is in line with the solid results of previous years, with a net income of 2,021 billion euros in 2024, thus strengthening the Group's confidence in its ability to create long-term value for its shareholders.;positive
17/08/25 02:00;DANONE (BN);Agroalimentaire;"""Wellington Management Group reduces its stake in Danone to 4.99% of the capital""";Wellington Management Group LLP, acting on behalf of funds and customers, reported to the AMF that on June 18, it had crossed the 5% threshold of Danone's capital, as a result of a sale of shares on the market. The declarant specified that it held 12,769,809 Danone shares representing as many voting rights, i.e. 4,99% of the capital and 4,17% of the voting rights of the agri-food group, while the current price of Danone share is €337.02. This sale relates to a share of the capital which had contributed €881 million to Danone's net profit in the previous year, the total turnover of which was €27.62 billion.;negative
